{
  "number": 7,
  "name": "Example Name",
  "startTime": "2026-05-03T14:30:00Z",
  "endTime": "2026-05-03T14:30:00Z",
  "isDaytime": false,
  "temperatureUnit": "F",
  "temperatureTrend": "falling",
  "windDirection": "SSE",
  "icon": "https://api.weather.gov/resource/example",
  "shortForecast": "example-value",
  "detailedForecast": "example-value"
}